{"version":"scxml.session-snapshot-diff/v2","before":{"sha256":"907f5f48196ab46c6b7c90d9620e2ac1472ace20113403fea357466ae917b133"},"after":{"sha256":"bb091f98eb253e92cdc1048ed12ac83e09676463c7c37b3b2c7293e0919af821"},"identical":false,"compatible":true,"skipped":[],"sessions":[{"path":["root"],"change":"changed","configuration":{"exited":["idle"],"entered":["waiting"]},"data_model":[{"name":"count","change":"changed","from":{"type":"number","value":"0"},"to":{"type":"number","value":"1"}}],"counters":{"send":{"from":0,"to":1}},"pending_sends":{"added":[{"sendid":"tick","event":{"name":"tick","type":"external","origin":"#_scxml_session","origintype":"http://www.w3.org/TR/scxml/#SCXMLEventProcessor","sendid":"tick","data":{"type":"undefined"},"raw":"_scxmleventname=tick"},"delay_ms":100,"deadline_ms":100},{"sendid":"sendid_0","event":{"name":"tock","type":"external","origin":"#_scxml_session","origintype":"http://www.w3.org/TR/scxml/#SCXMLEventProcessor","data":{"type":"undefined"},"raw":"_scxmleventname=tock"},"delay_ms":100,"deadline_ms":100}],"removed":[]},"transitions":{"added":[{"source":"waiting","index":0},{"source":"waiting","index":1}],"removed":[{"source":"idle","index":0}]}}]}