{"version":"scxml.session-snapshot-diff/v2","before":{"sha256":"a59afeb6239f58e20bd0518e55d483d918455d1dd5ee76ad1880155f4455cfef"},"after":{"sha256":"62a7ad5876a80f3fa960bc65a9aa7f4142399410a91719312a020a0b4141be64"},"identical":false,"compatible":true,"skipped":[],"sessions":[{"path":["root"],"change":"changed","queues":{"external":{"consumed":0,"appended":[{"name":"hello","type":"external","origin":"#_scxml_session.kid","origintype":"http://www.w3.org/TR/scxml/#SCXMLEventProcessor","invokeid":"kid","data":{"type":"undefined"},"raw":"_scxmleventname=hello"}]}}},{"path":["root","kid"],"change":"changed","data_model":[{"name":"pings","change":"changed","from":{"type":"number","value":"0"},"to":{"type":"number","value":"1"}}],"queues":{"external":{"consumed":1,"appended":[]}}}]}