{"version":"scxml.session-snapshot-diff/v2","before":{"sha256":"032b81e37510c98ac9b263efbcf58d71597b79f1b9558c4e0f789a7835a78ed7"},"after":{"sha256":"5de2d213ef44d4a5731f09fd83d3d6c05b27b4cd8fb2e94fb39802d6bd39eb5d"},"identical":false,"compatible":true,"skipped":[],"sessions":[{"path":["root","kid"],"change":"changed","queues":{"external":{"consumed":0,"appended":[{"name":"stop","type":"external","data":{"type":"absent"}}]}}}]}