{"version":"scxml.session-snapshot-diff/v2","before":{"sha256":"6259dff29fe72f364af36beb4725474547c29d4f361d76dea380dee6a3f584c3"},"after":{"sha256":"dbde997b439f68449414362a10aa7a67711e4dfeb51b4cbbc23c178f3c50301e"},"identical":false,"compatible":true,"skipped":[],"sessions":[{"path":["root"],"change":"changed","configuration":{"exited":["s"],"entered":["t"]},"transitions":{"added":[],"removed":[{"source":"s","index":0}]}}]}