{"version":"scxml.session-snapshot-diff/v2","before":{"sha256":"59a209ea4be5c9ff4308f4b4267637ba97cff9ad6621f9528453e7c62baeb1f9"},"after":{"sha256":"cb7efb9b0bfcd2684375efe6ce6ba0d9f21380773ae439ca90e6fc6400d8551d"},"identical":false,"compatible":true,"skipped":[],"sessions":[{"path":["root"],"change":"changed","configuration":{"exited":["s"],"entered":["t"]},"data_model":[{"name":"count","change":"changed","from":{"type":"number","value":"0"},"to":{"type":"number","value":"2"}},{"name":"box","change":"changed","from":{"type":"null"},"to":{"type":"text","typeof":"object","text":"[object Object]"}}],"transitions":{"added":[{"source":"t","index":0}],"removed":[{"source":"s","index":0}]}}]}